{"agent":"replay-safety-tester","run_id":"pentest-20260830T225244Z","scope_sha256":"652414263f85a927d2bab89cbf4635a1f4679eb3451a43e1f3e394f5a77de4e4","status":"PASS","findings":[],"checks":[{"name":"passive-mode and loopback restriction","result":"PASS","evidence":"scripts/security-team.mjs enforces passive default mode and rejects active-local targets unless the hostname is one of 127.0.0.1, localhost, or ::1; prompt text also forbids network traffic in passive mode."},{"name":"preview approval cancel are one-time and explicit","result":"PASS","evidence":"packages/server/src/app.ts requires explicit approval for /replay/:token/send, deletes the prepared token on send or cancel, and returns networkRequests: 0 for preview/cancel paths."},{"name":"single outbound request with no auto-follow or retries","result":"PASS","evidence":"packages/server/src/replay/httpClient.ts uses fetch(..., { redirect: \"manual\" }) and performs one request attempt only; it surfaces redirectLocation without following it and has no retry loop."},{"name":"rate and stop checks fail closed","result":"PASS","evidence":"packages/core/src/scope/scope.ts denies requests when manual stop, authentication loss, repeated server errors, max request count, or rate exhaustion are active; packages/server/src/app.ts rechecks scope immediately before send."}],"limitations":["A local npm test attempt could not complete in this environment because Jest failed to persist its haste map under the Windows temp directory (EPERM), so verification is source-and-test review rather than a full green test run."]}