{"agent":"agentic-threat-analyst","run_id":"redteam-20260830T225244Z","scope_sha256":"284df67983aed6b55cc73ae5d4f4d9c30da88539d6f6b1953857bc650e3556b3","status":"PASS","findings":[],"checks":[{"name":"prompt-and-scope confinement","result":"PASS","evidence":"[scripts/security-team.mjs](C:/Users/SuperAdmin/.vscode/SurfaceTrace/scripts/security-team.mjs) builds the prompt from the scoped manifest, restricts active-local targets to loopback hostnames only, and tells the agent not to send network traffic in passive mode or follow redirects/retry automatically."},{"name":"untrusted artifact handling","result":"PASS","evidence":"[packages/core/src/har/importHar.ts](C:/Users/SuperAdmin/.vscode/SurfaceTrace/packages/core/src/har/importHar.ts) redacts credential-bearing headers/cookies/body fields during import, and [packages/server/src/replay/httpClient.ts](C:/Users/SuperAdmin/.vscode/SurfaceTrace/packages/server/src/replay/httpClient.ts) uses manual redirect mode plus redacted response handling before persistence."},{"name":"tool authority and automation escalation gates","result":"PASS","evidence":"[packages/server/src/replay/reconstruct.ts](C:/Users/SuperAdmin/.vscode/SurfaceTrace/packages/server/src/replay/reconstruct.ts) requires explicit target identity material for identity replay, rejects replay when baseline redactions remain, and reconstructs exactly one mutation; [packages/server/src/app.ts](C:/Users/SuperAdmin/.vscode/SurfaceTrace/packages/server/src/app.ts) wires these gates into the replay send path."}],"limitations":["Static source review only; no network activity was performed.","Attempted `npm test --workspace=@surfacetrace/core -- --runInBand`, but Jest could not create its temp haste-map file in this environment (`EPERM` under the system temp directory), so runtime test evidence is limited to source inspection."]}