{"agent":"abuse-case-analyst","run_id":"redteam-20260830T230449Z","scope_sha256":"25caef6c23720a39cdaf3720e24da6fdd9a46b9f4b77ff9b4986ec94de74a793","status":"PASS","findings":[],"checks":[{"name":"remote API access boundary and single-user loopback architecture","result":"PASS","evidence":"[packages/server/src/index.ts:5-8] enforces loopback by default and requires SURFACETRACE_API_TOKEN for non-loopback HOST; [packages/server/src/app.ts:194-196,317] validates a >=32-character token and rejects non-loopback API access without a bearer token; [README.md:55] and [docs/ARCHITECTURE.md:122-124] document the explicit single-user local boundary."},{"name":"evidence record ID tamper detection","result":"PASS","evidence":"[packages/core/src/evidence/ledger.ts:19-23,41-53] derives id from contentHash and verifies r.id === r.contentHash.slice(0, 24) during chain validation; [packages/core/test/core.test.ts:272-282] includes a regression test that mutates id and expects verify() to fail."},{"name":"canonical three-agent roster integrity","result":"PASS","evidence":"[scripts/security-team.mjs:21-93] defines the canonical three-agent team list, embeds it into the run manifest scope, and freezes if manifest.agents differs from the expected roster; [scripts/test/security-team.test.mjs:31-39] covers the reduced-roster freeze case."},{"name":"receipt contract validation","result":"PASS","evidence":"[security-teams/receipt-schema.json] requires agent, run_id, scope_sha256, status, findings, checks, and limitations with typed fields; [scripts/security-team.mjs:22-40] enforces required receipt structure, valid status values, nonempty checks, and nonempty evidence strings before gate evaluation."},{"name":"blocking of failed or untested checks","result":"PASS","evidence":"[scripts/security-team.mjs:80-89] returns BLOCK when any receipt has status other than PASS, any check result is not PASS, or any actionable finding is present; [scripts/test/security-team.test.mjs:41-49] asserts BLOCK when a PASS receipt contains a failed check."}],"limitations":["Passive source-and-test review only; no network traffic was sent.","`node --test` could not complete a full workspace run in this environment because the Windows temp-directory mkdtemp path used by the test harness returned EPERM; verification therefore relies on the current source plus targeted test files and the partially executed test run."]}