{"agent":"evidence-integrity-tester","run_id":"pentest-20260830T225244Z","scope_sha256":"652414263f85a927d2bab89cbf4635a1f4679eb3451a43e1f3e394f5a77de4e4","status":"FAIL","findings":[{"severity":"medium","title":"Evidence ledger does not verify record IDs","evidence":"[packages/core/src/evidence/ledger.ts#L41-L54] recomputes and checks only `prevHash` and `contentHash`; `id` is never validated. Because `append()` derives `id` from `contentHash.slice(0, 24)` [L20-L27], a persisted or in-memory edit to `record.id` can survive `verify()` and break provenance references without invalidating the chain.","recommendation":"Validate that each record `id` matches the expected derivation from `contentHash`, or include `id` in the hashed payload and reject mismatches during construction/verification."}],"checks":[{"name":"hash-chain verification","result":"PASS","evidence":"[packages/core/src/evidence/ledger.ts#L41-L54] verifies link continuity and recomputed content hashes for every record."},{"name":"append-only hashing inputs","result":"PASS","evidence":"[packages/core/src/evidence/ledger.ts#L18-L29] binds `kind`, `payload`, `prev`, and `createdAt` into each `contentHash`."},{"name":"receipt contract location","result":"PASS","evidence":"[security-teams/README.md] defines the required JSON receipt shape and evidence expectation for this run."}],"limitations":["Passive source review only; no network traffic or runtime replay was performed.","I did not execute the workspace test suite because the local shell requires a noninteractive `npm.cmd` path under PowerShell and the environment is read-only for modifications."]}