{"agent":"evidence-integrity-tester","run_id":"pentest-20260830T230449Z","scope_sha256":"4b71dc963976c3a4b1c024f3ca1e6c42edfa5e4afad778905cd6b6e2ffb7b2e5","status":"PASS","findings":[],"checks":[{"name":"node version gate","result":"PASS","evidence":"`node --version` returned `v22.23.2` after PATH override to `$env:USERPROFILE\\.toolchains\\node-v22.23.2-win-x64`."},{"name":"team:test closures","result":"PASS","evidence":"`npm.cmd run team:test` passed all 5 subtests in `scripts/test/security-team.test.mjs` with 5/5 passing."},{"name":"core workspace tests","result":"PASS","evidence":"`npm.cmd test --workspace=@surfacetrace/core` passed: 1 suite, 116 tests, 0 failures."},{"name":"server workspace tests","result":"PASS","evidence":"`npm.cmd test --workspace=@surfacetrace/server` passed: 3 suites, 30 tests, 0 failures."},{"name":"scope and integrity","result":"PASS","evidence":"No source or configuration files were modified; verification was performed in passive, local-only mode within the provided scope."}],"limitations":[]}