{"agent":"replay-safety-tester","run_id":"pentest-20260830T230449Z","scope_sha256":"4b71dc963976c3a4b1c024f3ca1e6c42edfa5e4afad778905cd6b6e2ffb7b2e5","status":"PASS","findings":[],"checks":[{"name":"remote API access boundary","result":"PASS","evidence":"packages/server/src/app.ts:122,194,196,313-317; packages/server/src/index.ts:6-8"},{"name":"explicit single-user loopback architecture","result":"PASS","evidence":"README.md:55; docs/ARCHITECTURE.md:122-124"},{"name":"evidence record ID tamper detection","result":"PASS","evidence":"packages/core/src/evidence/ledger.ts:21,41-52"},{"name":"canonical three-agent roster integrity","result":"PASS","evidence":"scripts/security-team.mjs:78-81,81-91"},{"name":"receipt contract validation and blocking of failed or untested checks","result":"PASS","evidence":"scripts/security-team.mjs:23-32,85-91"}],"limitations":["Passive source review only; no network traffic was sent.","A runtime server test attempt was blocked by the local Windows environment (`jest` EPERM writing its haste-map temp file), so verification is source-backed rather than execution-backed."]}