{"agent":"abuse-case-analyst","run_id":"redteam-20260830T225244Z","scope_sha256":"284df67983aed6b55cc73ae5d4f4d9c30da88539d6f6b1953857bc650e3556b3","status":"PASS","findings":[],"checks":[{"name":"scope isolation and loopback restriction","result":"PASS","evidence":"scripts/security-team.mjs:25-37 and scripts/test/security-team.test.mjs:16-17"},{"name":"receipt gate requires matching scoped evidence-backed receipts","result":"PASS","evidence":"scripts/security-team.mjs:62-76 and security-teams/receipt-schema.json"},{"name":"redteam prompts constrain passive and active-local behavior","result":"PASS","evidence":"scripts/security-team.mjs:47-55 and security-teams/README.md:24-40"}],"limitations":["Passive source review only; no network traffic was sent.","No runtime exploitation or live loopback validation was performed."]}