{"agent":"access-control-tester","run_id":"pentest-20260830T225244Z","scope_sha256":"652414263f85a927d2bab89cbf4635a1f4679eb3451a43e1f3e394f5a77de4e4","status":"FAIL","findings":[{"severity":"high","title":"No authentication or authorization guard protects any management route","evidence":"packages/server/src/app.ts exposes project, scope, import, inventory, experiment, asset, trust-boundary, and identity endpoints directly, and the only request hooks are persistence/cors/error handling. Example routes include /projects, /projects/:projectId/open, /import/har, /inventory, and /observations/:observationId/identity (packages/server/src/app.ts:338-483, 998-1469).","recommendation":"Add an explicit authentication layer and enforce authorization on every state-changing and data-bearing route. Bind requests to an authenticated principal before allowing reads or writes."},{"severity":"medium","title":"Tenant isolation is not enforced for projects or observations","evidence":"The server keeps a single global activeProject and returns all projects via GET /projects, while POST /projects/:projectId/open loads any project ID and swaps global state without checking ownership, tenant membership, or caller identity (packages/server/src/app.ts:128-170, 346-370). Observation identity assignment also accepts any observation/identity pair once a HAR has been imported (packages/server/src/app.ts:1025-1047).","recommendation":"Model tenant or workspace ownership explicitly and require that each project, observation, and identity be authorized against the caller's tenant before enumeration, opening, or mutation."}],"checks":[{"name":"authn/authz gate present","result":"FAIL","evidence":"No auth middleware, session check, or principal lookup is registered before route handlers; only cors, error handling, and persistence hooks are present in buildApp (packages/server/src/app.ts:221-266)."},{"name":"project enumeration is access-controlled","result":"FAIL","evidence":"GET /projects returns persistence.listProjects() with no caller validation, and POST /projects/:projectId/open loads arbitrary project IDs (packages/server/src/app.ts:346-370)."},{"name":"explicit identity transition is bounded","result":"FAIL","evidence":"PATCH /observations/:observationId/identity accepts any known identityId and rewrites the observation's identity assignment without checking that the caller may act for that identity (packages/server/src/app.ts:1025-1047)."},{"name":"tenant-scoped evidence review","result":"FAIL","evidence":"The app stores one global investigation state and exposes it through /inventory and /evidence without tenant partitioning (packages/server/src/app.ts:998-1022, 474-479)."}],"limitations":["Passive source review only; no network traffic or runtime interaction was performed.","The repository appears to be a single-user/local tooling app, so tenant-risk conclusions are based on code structure rather than observed multi-tenant deployment behavior."]}