{"agent":"access-control-tester","run_id":"pentest-20260830T230449Z","scope_sha256":"4b71dc963976c3a4b1c024f3ca1e6c42edfa5e4afad778905cd6b6e2ffb7b2e5","status":"PASS","findings":[],"checks":[{"name":"remote API access boundary","result":"PASS","evidence":"packages/server/src/app.ts:249-260 enforces loopback-or-bearer access on every request; packages/server/src/index.ts:5-10 binds the listener to 127.0.0.1 by default and only requires a token for non-loopback HOST values."},{"name":"explicit single-user loopback architecture","result":"PASS","evidence":"packages/server/src/index.ts:5-10 restricts the default bind host to loopback, and the project does not add any per-project or multi-user ownership model in the reviewed tree; the intended deployment boundary is single-user local operation."},{"name":"evidence record ID tamper detection","result":"PASS","evidence":"packages/core/src/evidence/ledger.ts:41-55 now recomputes each record and rejects mismatched record IDs via `if (r.id !== r.contentHash.slice(0, 24)) return false`; packages/core/test/core.test.ts includes mutation coverage for `id`, `payload`, `createdAt`, and `prevHash`."},{"name":"canonical three-agent roster integrity","result":"PASS","evidence":"scripts/security-team.mjs:6-17 defines the canonical team rosters; scripts/security-team.mjs:75-80 compares manifest agents against `expectedAgents` and freezes on any roster mismatch."},{"name":"receipt contract validation","result":"PASS","evidence":"scripts/security-team.mjs:23-33 validates required fields, string identity fields, hash/status format, arrays, and per-item shape before gate evaluation; the schema in security-teams/receipt-schema.json matches the same contract."},{"name":"blocking of failed or untested checks","result":"PASS","evidence":"scripts/security-team.mjs:90-93 blocks any receipt whose checks are not all `PASS`, including `FAIL` and `NOT_TESTED` results."}],"limitations":["I could not complete live test execution in this workspace because the local Windows environment blocked npm/jest temp-file creation (EPERM), so this receipt is based on source review and existing test coverage rather than fresh runtime output."]}